{
  "schema_version": "1.0",
  "id": "CH-EXEMPLO-001",
  "work_item_id": "WI-EXEMPLO-001",
  "run_id": "RUN-YYYYMMDD-EXEMPLO-001",
  "status": "PLANNED",
  "challengers": ["agent:adversarial-reviewer"],
  "attacks": [
    {
      "title": "Tentativa de falsificação",
      "attack": "Como a condição poderia ser burlada.",
      "expected_failure": "O gate rejeita a falsificação.",
      "mitigation": "Controle que impede a burla.",
      "verification": "Teste reproduzível do controle."
    }
  ],
  "verdict": "REQUIRES_HARDENING",
  "created_at": "2099-01-01T00:00:00Z"
}
